{
  "manifest_version": 1,
  "source_id": "smithsonian_open_access_cc0",
  "source_name": "Smithsonian Open Access",
  "source_type": "website",
  "source_family": "third_party_general",
  "owner": "Smithsonian Institution",
  "owner_contact": "https://www.si.edu/openaccess",
  "license": "cc0-1.0",
  "license_url": "https://www.si.edu/openaccess",
  "rights_basis": "open-license",
  "allowed_for_training": true,
  "allowed_for_rag": true,
  "eligibility_class": "training_and_retrieval",
  "attribution_required": false,
  "attribution_text": "",
  "share_alike_required": false,
  "removal_required": false,
  "collection_date": "2026-04-04T00:00:00Z",
  "version": "2026-04-04",
  "status": "active",
  "review_status": "approved",
  "provenance_status": "complete",
  "seed_urls": [
    "https://www.si.edu/openaccess"
  ],
  "allowed_domains": [
    "www.si.edu",
    "si.edu"
  ],
  "host_policy": {
    "fail_closed_on_robots": true,
    "respect_crawl_delay": true,
    "crawl_delay_seconds": 1.0,
    "requests_per_minute": 12,
    "max_parallel_requests": 1,
    "daily_url_budget": 40,
    "user_agent": "JesterCrawler/1.0 (contact: sources@jester.local)",
    "allowed_schemes": ["https"],
    "allowed_path_prefixes": ["/openaccess", "/object"],
    "blocked_url_patterns": [
      "/search/",
      "/about/",
      "/visit/"
    ],
    "robots_override_allowlist": []
  },
  "removal_path": "https://www.si.edu/openaccess",
  "quarantine_rules": {
    "on_unknown_rights": "quarantine",
    "on_missing_provenance": "quarantine",
    "on_robots_failure": "quarantine",
    "on_suspect_extraction": "quarantine"
  },
  "scope_notes": "Restricted to Smithsonian Open Access landing pages and object pages. This manifest captures HTML metadata/text only; binary media ingestion remains separate.",
  "notes": "Added from the Creative Commons source set."
}
