{
  "manifest_version": 1,
  "source_id": "dndwiki_character_creation_5e24_cc_by",
  "source_name": "D&D Wiki Character Creation (5e24)",
  "source_type": "website",
  "source_family": "dnd_srd",
  "owner": "Dungeons and Dragons Wiki",
  "owner_contact": "https://dnd-wiki.org/wiki/SRD_5.2_%285e24%29",
  "license": "cc-by-4.0",
  "license_url": "https://creativecommons.org/licenses/by/4.0/",
  "rights_basis": "open-license",
  "allowed_for_training": true,
  "allowed_for_rag": true,
  "eligibility_class": "training_and_retrieval",
  "attribution_required": true,
  "attribution_text": "Attribute Wizards of the Coast LLC and identify the source as System Reference Document 5.2 available at https://www.dndbeyond.com/srd under CC BY 4.0.",
  "share_alike_required": false,
  "removal_required": false,
  "collection_date": "2026-04-16T00:00:00Z",
  "version": "2026-04-16",
  "status": "active",
  "review_status": "approved",
  "provenance_status": "complete",
  "seed_urls": [
    "https://dnd-wiki.org/wiki/Character_Creation_%285e24%29"
  ],
  "allowed_domains": [
    "dnd-wiki.org"
  ],
  "host_policy": {
    "fail_closed_on_robots": true,
    "respect_crawl_delay": true,
    "crawl_delay_seconds": 1.0,
    "requests_per_minute": 8,
    "max_parallel_requests": 1,
    "daily_url_budget": 1,
    "user_agent": "JesterCrawler/1.0 (contact: sources@jester.local)",
    "allowed_schemes": [
      "https"
    ],
    "allowed_path_prefixes": [
      "/wiki/Character_Creation_%285e24%29"
    ],
    "blocked_url_patterns": [
      "/w/index\\.php",
      "/wiki/Special:"
    ],
    "robots_override_allowlist": []
  },
  "removal_path": "https://dnd-wiki.org/wiki/SRD_5.2_%285e24%29",
  "quarantine_rules": {
    "on_unknown_rights": "quarantine",
    "on_missing_provenance": "quarantine",
    "on_robots_failure": "quarantine",
    "on_suspect_extraction": "quarantine"
  },
  "scope_notes": "Exact-page D&D Wiki SRD 5.2 manifest. The reviewed page explicitly states that the file is licensed under CC-BY and attributes Wizards of the Coast LLC.",
  "notes": "Verified on 2026-04-16 against current D&D Wiki SRD 5.2 pages marked CC-BY."
}
