{
  "manifest_version": 1,
  "source_id": "dnd5e_info_ogl_1_0a",
  "source_name": "DnD5e.info SRD",
  "source_type": "website",
  "source_family": "dnd_srd",
  "owner": "Fortiter Games / DnD5e.info",
  "owner_contact": "https://dnd5e.info/",
  "license": "ogl-1.0a",
  "license_url": "https://dnd5e.info/adventuring/",
  "rights_basis": "open-license",
  "allowed_for_training": false,
  "allowed_for_rag": true,
  "eligibility_class": "retrieval_only",
  "attribution_required": true,
  "attribution_text": "Preserve the Open Game License v1.0a notice and the site's copyright notices for Open Game Content pages.",
  "share_alike_required": false,
  "removal_required": false,
  "collection_date": "2026-04-04T00:00:00Z",
  "version": "2026-04-04",
  "status": "active",
  "review_status": "approved",
  "provenance_status": "complete",
  "seed_urls": [
    "https://dnd5e.info/adventuring/",
    "https://dnd5e.info/combat/",
    "https://dnd5e.info/spells/"
  ],
  "allowed_domains": [
    "dnd5e.info",
    "www.dnd5e.info"
  ],
  "host_policy": {
    "fail_closed_on_robots": true,
    "respect_crawl_delay": true,
    "crawl_delay_seconds": 1.0,
    "requests_per_minute": 15,
    "max_parallel_requests": 1,
    "daily_url_budget": 80,
    "user_agent": "JesterCrawler/1.0 (contact: sources@jester.local)",
    "allowed_schemes": ["https"],
    "allowed_path_prefixes": [
      "/adventuring",
      "/appendix",
      "/backgrounds",
      "/classes",
      "/combat",
      "/equipment",
      "/feats",
      "/monsters",
      "/races",
      "/spellcasting",
      "/spells",
      "/using-ability-scores"
    ],
    "blocked_url_patterns": [
      "/privacy",
      "/terms",
      "/feed",
      "/comments"
    ],
    "robots_override_allowlist": []
  },
  "removal_path": "https://dnd5e.info/",
  "quarantine_rules": {
    "on_unknown_rights": "quarantine",
    "on_missing_provenance": "quarantine",
    "on_robots_failure": "quarantine",
    "on_suspect_extraction": "quarantine"
  },
  "scope_notes": "Current policy treats OGL 1.0a sources as retrieval-only until a separate training-rights review is completed.",
  "notes": "Added from the SRD/Open Game Content source set."
}
