{
  "manifest_version": 1,
  "source_id": "d20srd_ogl_1_0a",
  "source_name": "d20 SRD",
  "source_type": "website",
  "source_family": "dnd_srd",
  "owner": "BoLS Interactive LLC / Hypertext d20 SRD",
  "owner_contact": "https://www.d20srd.org/",
  "license": "ogl-1.0a",
  "license_url": "https://www.d20srd.org/ogl.htm",
  "rights_basis": "open-license",
  "allowed_for_training": false,
  "allowed_for_rag": true,
  "eligibility_class": "retrieval_only",
  "attribution_required": true,
  "attribution_text": "Preserve the Open Game License v1.0a notice and the Hypertext d20 SRD copyright notice for Open Game Content pages.",
  "share_alike_required": false,
  "removal_required": false,
  "collection_date": "2026-04-04T00:00:00Z",
  "version": "2026-04-04",
  "status": "active",
  "review_status": "approved",
  "provenance_status": "complete",
  "seed_urls": [
    "https://www.d20srd.org/srd/"
  ],
  "allowed_domains": [
    "www.d20srd.org",
    "d20srd.org"
  ],
  "host_policy": {
    "fail_closed_on_robots": true,
    "respect_crawl_delay": true,
    "crawl_delay_seconds": 1.0,
    "requests_per_minute": 15,
    "max_parallel_requests": 1,
    "daily_url_budget": 80,
    "user_agent": "JesterCrawler/1.0 (contact: sources@jester.local)",
    "allowed_schemes": ["https"],
    "allowed_path_prefixes": ["/srd"],
    "blocked_url_patterns": [
      "/ogl\\.htm",
      "/faq",
      "/community",
      "/forums"
    ],
    "robots_override_allowlist": []
  },
  "removal_path": "https://www.d20srd.org/",
  "quarantine_rules": {
    "on_unknown_rights": "quarantine",
    "on_missing_provenance": "quarantine",
    "on_robots_failure": "quarantine",
    "on_suspect_extraction": "quarantine"
  },
  "scope_notes": "Current policy treats OGL 1.0a sources as retrieval-only until a separate training-rights review is completed.",
  "notes": "Added from the SRD/Open Game Content source set."
}
