{
  "manifest_version": 1,
  "source_id": "open5e_ogl_1_0a",
  "source_name": "Open5e",
  "source_type": "website",
  "source_family": "dnd_srd",
  "owner": "Open5e",
  "owner_contact": "https://open5e.com/legal/",
  "license": "ogl-1.0a",
  "license_url": "https://open5e.com/legal/",
  "rights_basis": "open-license",
  "allowed_for_training": false,
  "allowed_for_rag": true,
  "eligibility_class": "retrieval_only",
  "attribution_required": true,
  "attribution_text": "Preserve the Open Game License v1.0a notice and any copyright notices attached to Open5e Open Game Content pages.",
  "share_alike_required": false,
  "removal_required": false,
  "collection_date": "2026-04-04T00:00:00Z",
  "version": "2026-04-04",
  "status": "active",
  "review_status": "approved",
  "provenance_status": "complete",
  "seed_urls": [
    "https://open5e.com/classes",
    "https://open5e.com/spells",
    "https://open5e.com/monsters"
  ],
  "allowed_domains": [
    "open5e.com",
    "www.open5e.com"
  ],
  "host_policy": {
    "fail_closed_on_robots": true,
    "respect_crawl_delay": true,
    "crawl_delay_seconds": 1.0,
    "requests_per_minute": 15,
    "max_parallel_requests": 1,
    "daily_url_budget": 80,
    "user_agent": "JesterCrawler/1.0 (contact: sources@jester.local)",
    "allowed_schemes": ["https"],
    "allowed_path_prefixes": [
      "/backgrounds",
      "/characters",
      "/classes",
      "/combat",
      "/conditions",
      "/equipment",
      "/feats",
      "/magic-items",
      "/monsters",
      "/races",
      "/spells"
    ],
    "blocked_url_patterns": [
      "/legal",
      "/privacy",
      "/terms",
      "/api",
      "/login",
      "/signup"
    ],
    "robots_override_allowlist": []
  },
  "removal_path": "https://open5e.com/legal/",
  "quarantine_rules": {
    "on_unknown_rights": "quarantine",
    "on_missing_provenance": "quarantine",
    "on_robots_failure": "quarantine",
    "on_suspect_extraction": "quarantine"
  },
  "scope_notes": "Current policy treats OGL 1.0a sources as retrieval-only until a separate training-rights review is completed.",
  "notes": "Added from the SRD/Open Game Content source set."
}
