{
  "manifest_version": 1,
  "source_id": "project_gutenberg_public_domain",
  "source_name": "Project Gutenberg (US public-domain corpus)",
  "source_type": "website",
  "source_family": "public_domain",
  "owner": "Project Gutenberg Literary Archive Foundation",
  "owner_contact": "https://www.gutenberg.org/about/contact_information.html",
  "license": "public-domain",
  "license_url": "https://www.gutenberg.org/policy/terms_of_use.html",
  "rights_basis": "public-domain",
  "allowed_for_training": true,
  "allowed_for_rag": true,
  "eligibility_class": "training_and_retrieval",
  "attribution_required": false,
  "attribution_text": "",
  "share_alike_required": false,
  "removal_required": false,
  "collection_date": "2026-04-04T00:00:00Z",
  "version": "2026-04-04",
  "status": "active",
  "review_status": "approved",
  "provenance_status": "complete",
  "seed_urls": [
    "https://www.gutenberg.org/ebooks/"
  ],
  "allowed_domains": [
    "www.gutenberg.org",
    "gutenberg.org"
  ],
  "host_policy": {
    "fail_closed_on_robots": true,
    "respect_crawl_delay": true,
    "crawl_delay_seconds": 1.0,
    "requests_per_minute": 20,
    "max_parallel_requests": 1,
    "daily_url_budget": 100,
    "user_agent": "JesterCrawler/1.0 (contact: sources@jester.local)",
    "allowed_schemes": ["https"],
    "allowed_path_prefixes": ["/ebooks"],
    "blocked_url_patterns": [
      "/policy/",
      "/cache/",
      "/files/",
      "/help/",
      "/wiki/"
    ],
    "robots_override_allowlist": []
  },
  "removal_path": "https://www.gutenberg.org/about/contact_information.html",
  "quarantine_rules": {
    "on_unknown_rights": "quarantine",
    "on_missing_provenance": "quarantine",
    "on_robots_failure": "quarantine",
    "on_suspect_extraction": "quarantine"
  },
  "scope_notes": "Treat as US public-domain text only; do not expand beyond Project Gutenberg ebook catalog pages without title-level provenance review.",
  "notes": "Added from the public-domain fantasy and mythology source set. Seed path is intentionally limited to ebook catalog pages."
}
